{
  "schema_version": "0.1",
  "units": "SI",
  "mesh": {
    "path": "../../validation/fixtures/tet4-positive.msh",
    "groups": {
      "nodes": [
        "base"
      ],
      "surfaces": [
        "base"
      ],
      "volumes": [
        "solid"
      ]
    }
  },
  "materials": [
    {
      "id": "steel",
      "type": "isotropic_linear_elastic",
      "young": 210000000000.0,
      "poisson": 0.3
    }
  ],
  "material_assignments": [
    {
      "region": "solid",
      "material": "steel"
    }
  ],
  "boundary_conditions": [
    {
      "node_group": "base",
      "components": {
        "x": 0.0,
        "y": 0.0,
        "z": 0.0
      }
    }
  ],
  "loads": [
    {
      "type": "nodal_force",
      "node": 4,
      "components": {
        "x": 0.0,
        "y": 0.0,
        "z": -1.0
      }
    }
  ],
  "analysis": {
    "type": "linear_static_3d"
  },
  "solver_settings": {
    "method": "cg",
    "preconditioner": "jacobi",
    "rtol": 1e-10,
    "atol": 1e-12,
    "max_iterations": 1000
  },
  "outputs": {
    "formats": [
      "vtu",
      "csv",
      "json"
    ]
  }
}
